{
  "schema": "ihat://identity/step-up-evidence/v1",
  "id": "step-up/nerp-role-change-001",
  "revision": 1,
  "created_at": "2026-08-03T01:00:20.000Z",
  "updated_at": "2026-08-03T01:00:20.000Z",
  "digest": "sha256:19ec78f133083d1880885af679b0415af3361d28421fb9e228843058551510b3",
  "service_account_id": "service-account/nerp-001",
  "pairwise_subject": "pairwise_nerp_subject_001",
  "device_id": "device/windows-001",
  "workload_id": "local-workload/nerp-bff",
  "actor_id": "service/nerp-bff",
  "issuer": "https://id.ihat.online",
  "audience": "nerp",
  "authentication_event_id": "auth-event/provider-event-001",
  "authentication_methods": ["passkey"],
  "assurance": "phishing-resistant",
  "authenticated_at": "2026-08-03T01:00:20.000Z",
  "expires_at": "2026-08-03T01:01:00.000Z",
  "nonce_digest": "sha256:4444444444444444444444444444444444444444444444444444444444444444",
  "operation_digest": "sha256:6666666666666666666666666666666666666666666666666666666666666666",
  "provider_evidence_digest": "sha256:8888888888888888888888888888888888888888888888888888888888888888",
  "proof_key_thumbprint": "sha256:1111111111111111111111111111111111111111111111111111111111111111",
  "revocation_epoch": 0
}
